{
  "$schema": "http://json-schema.org/draft-07/schema#",
  "title": "Momo Paper · FAQ Page",
  "type": "object",
  "required": ["document_type", "locale", "meta", "sections"],
  "properties": {
    "document_type": { "type": "string", "const": "faq_page" },
    "locale": { "type": "string", "enum": ["zh-CN", "en"] },
    "meta": {
      "type": "object",
      "required": ["title", "subtitle"],
      "properties": {
        "title": { "type": "string" },
        "subtitle": { "type": "string" },
        "eyebrow": { "type": "string" }
      }
    },
    "sections": {
      "type": "object",
      "properties": {
        "lead": {
          "type": "object",
          "properties": {
            "body": { "type": "array", "items": { "type": "string" } }
          }
        },
        "groups": {
          "type": "array",
          "items": {
            "type": "object",
            "properties": {
              "title": { "type": "string" },
              "items": {
                "type": "array",
                "items": {
                  "type": "object",
                  "properties": {
                    "question": { "type": "string" },
                    "answer": { "type": "string" }
                  }
                }
              }
            }
          }
        },
        "summary": {
          "type": "object",
          "properties": {
            "body": { "type": "array", "items": { "type": "string" } },
            "next_step": { "type": "string" }
          }
        }
      }
    }
  }
}
