{
  "document_type": "faq_page",
  "locale": "zh-CN",
  "meta": {
    "title": "Momo Platform 常见问题",
    "subtitle": "帮助您快速上手并解决使用中的疑问",
    "eyebrow": "Momo Paper / faq_page / zh-CN"
  },
  "sections": {
    "lead": {
      "body": [
        "这里汇集了 Momo Platform 用户最常问的问题。如果找不到答案，请联系 support@momopaper.com。"
      ]
    },
    "groups": [
      {
        "title": "账号与订阅",
        "items": [
          {
            "question": "如何更改订阅计划？",
            "answer": "进入「设置」→「订阅」，选择新计划并确认即可。变更将在下一个计费周期生效。"
          },
          {
            "question": "可以多人共用一个账号吗？",
            "answer": "个人版仅支持单用户。如需团队协作，请升级至团队版或企业版。"
          },
          {
            "question": "如何取消订阅？",
            "answer": "进入「设置」→「订阅」→「取消订阅」。取消后，您仍可使用至当前计费周期结束。"
          }
        ]
      },
      {
        "title": "文档与协作",
        "items": [
          {
            "question": "支持哪些文件格式的导入导出？",
            "answer": "支持导入：Markdown、Word、HTML。支持导出：PDF、Word、HTML、PPTX。"
          },
          {
            "question": "实时协作最多支持多少人同时编辑？",
            "answer": "团队版支持最多 20 人同时编辑，企业版无限制。"
          },
          {
            "question": "文档有版本历史吗？",
            "answer": "是的。所有文档自动保存版本历史，可免费回溯最近 30 天的版本。企业版支持无限版本历史。"
          }
        ]
      },
      {
        "title": "安全与隐私",
        "items": [
          {
            "question": "我的文档数据安全吗？",
            "answer": "所有数据传输采用 TLS 1.3 加密，静态数据采用 AES-256 加密。我们通过了 SOC 2 Type II 认证。"
          },
          {
            "question": "可以私有化部署吗？",
            "answer": "企业版支持私有化部署。请联系 sales@momopaper.com 获取方案与报价。"
          }
        ]
      }
    ],
    "summary": {
      "body": [
        "如果您的问题仍未解决，欢迎通过以下方式联系我们。"
      ],
      "next_step": "客服邮箱：support@momopaper.com | 工作日 9:00-18:00 在线客服"
    }
  }
}
